{
  "event_id": "evt_secret-grant-issued_01J00000000000000000",
  "schema_version": 2,
  "tenant_id": "ten_01J00000000000000000000000",
  "producer_id": "platform-core-ledger",
  "provider_revision_id": null,
  "source_stream_id": "secret_grant/secg_01J00000000000000000000000",
  "source_event_id": "secret.grant.state.changed/1",
  "source_cursor": "1",
  "dedupe_key": "sha256:65f5cceca68398873ed74e1813966c253f307198c49481d679d982f47eaac7ee",
  "aggregate": {
    "type": "secret_grant",
    "id": "secg_01J00000000000000000000000",
    "sequence": 1
  },
  "type": "secret.grant.state.changed",
  "occurred_at": "2026-07-16T09:10:00Z",
  "actor": {
    "type": "system",
    "id": "artifact-service"
  },
  "data": {
    "secret_grant_id": "secg_01J00000000000000000000000",
    "secret_grant_digest": "sha256:a376866d4be26035eb75b9f018c9fb3b2a1b6732d700a4c7a4529b669d0e8919",
    "state": "issued",
    "evidence_digest": "sha256:0a9ad9a85db8ff4cf2a5cfd87f4378016678d58e890ac24bb1edc32c3bcfb7aa"
  },
  "metadata": {
    "trace_id": "trace-secret-grant-issued",
    "correlation_id": "secg_01J00000000000000000000000"
  },
  "data_version": 1,
  "recorded_at": "2026-07-16T09:10:00.100Z",
  "event_registry": {
    "registry_id": "platform-core",
    "registry_version": 1,
    "registry_digest": "sha256:a9e717df6ee3d524e9805b1d1d78b39957618985d7d3ff9ad0e984362d1ddde6"
  },
  "producer_kind": "platform",
  "execution_scope": {
    "kind": "work_order",
    "work_order_id": "wrk_01J00000000000000000000000"
  }
}
