{
  "event_id": "evt_artifact-operation-secret-grant-issued_01J00000000000000000",
  "schema_version": 2,
  "tenant_id": "ten_01J00000000000000000000000",
  "producer_id": "platform-core-ledger",
  "provider_revision_id": null,
  "source_stream_id": "secret_grant/secg_aop_01J000000000000000000000",
  "source_event_id": "secret.grant.state.changed/1",
  "source_cursor": "1",
  "dedupe_key": "sha256:412b1651ea875740b2443a35c2a2da31c080b99b68a452d35468b7c94eac8ebf",
  "aggregate": {
    "type": "secret_grant",
    "id": "secg_aop_01J000000000000000000000",
    "sequence": 1
  },
  "type": "secret.grant.state.changed",
  "occurred_at": "2026-07-16T09:10:00Z",
  "actor": {
    "type": "system",
    "id": "artifact-service"
  },
  "data": {
    "secret_grant_id": "secg_aop_01J000000000000000000000",
    "secret_grant_digest": "sha256:34d953afb2adf58f983ead4833153150826b27a9f3da421ee1c9f7d47dd3cba5",
    "state": "issued",
    "evidence_digest": "sha256:92d3117fa881147bb5dc62195406bb0b36ab163d05e3f8d8f29c4d956ff139a7"
  },
  "metadata": {
    "trace_id": "trace-artifact-operation-secret-grant-issued",
    "correlation_id": "secg_aop_01J000000000000000000000"
  },
  "data_version": 1,
  "recorded_at": "2026-07-16T09:10:00.100Z",
  "event_registry": {
    "registry_id": "platform-core",
    "registry_version": 1,
    "registry_digest": "sha256:28427711d938bf2b5282956fec72d4b5db93fa47f56c56426c6a9b3ec7133858"
  },
  "producer_kind": "platform",
  "execution_scope": {
    "kind": "artifact_operation",
    "artifact_operation_id": "aop_preview_01J000000000000000000"
  }
}
